{
  "id": 1,
  "name": "John Chase",
  "location": "Smallfield, Surrey, England",
  "status": "Available",
  "avatarPath": "img/Rat-Profile.svg",
  "photoPath": "img/Photo.png",
  "description": "I am a Full Stack Application Developer with over 20 years experience. I have a proven track record of delivering bespoke solutions to meet demanding customer needs and growing those solutions to keep up with a changing market. I enjoy collaborating with a diverse team to build and promote a good working environment geared at delivering high-quality solutions.\n\nSelect one of the tabs to find out more about me.",
  "email": "john.chase3@outlook.com",
  "linkedin": "https://www.linkedin.com/in/john-chase-57973b12/",
  "github": "https://github.com/RatJuggler",
  "twitter": "https://twitter.com/ratjuggler",
  "projects": [
    {
      "name": "The Great Pyramid Puzzle",
      "url": "https://ratjuggler.github.io/great-pyramid-puzzle/"
    },
    {
      "name": "JHipster Microservices",
      "url": "https://github.com/RatJuggler/jhipster-microservices-dinosaurs"
    },
    {
      "name": "Developer Portfolio (this site)",
      "url": "https://github.com/RatJuggler/developer-portfolio"
    },
    {
      "name": "Guinea Pig Twitter Bot",
      "url": "https://github.com/RatJuggler/guinea-bot"
    }
  ]
}
